{
  "schema": "layoutabi_compile_audit_v1",
  "schema_version": 1,
  "software": {
    "torch": "2.11.0+cu128",
    "cuda_build": "12.8"
  },
  "protocol": {
    "policies": [
      "direct",
      "repair_kv"
    ],
    "resolutions": [
      256,
      255,
      254,
      128,
      127,
      126
    ],
    "compile_mode": "reduce-overhead",
    "isolated_process_and_cache": true,
    "nsight_required": false
  },
  "points": [
    {
      "resolution": 256,
      "policies": {
        "direct": {
          "available": true,
          "first_call_ms": 5088.644099014346,
          "steady_state": {
            "n": 10,
            "median_ms": 0.4351744174957275,
            "mean_ms": 0.4375796890258789,
            "min_ms": 0.4349391937255859,
            "max_ms": 0.4584959983825684
          },
          "correctness": {
            "max_abs": 0.001953125,
            "relative_inf": 0.001001001001001001,
            "tolerance": 0.08,
            "pass": true
          },
          "artifacts": {
            "fx_graph": "fx_graph.txt",
            "export_graph": "export_graph.txt",
            "pre_fusion": "ir_pre_fusion.txt",
            "post_fusion": "ir_post_fusion.txt",
            "output_code": "output_code.py",
            "fx_transformed": "fx_graph_transformed.py",
            "fx_runnable": "fx_graph_runnable.py"
          },
          "profiler": {
            "available": true,
            "ordered_cuda_names": [
              "void at::native::(anonymous namespace)::multi_tensor_apply_kernel<at::native::(anonymous namespace)::TensorListMetadata<2>, at::native::(anonymous namespace)::UnaryOpFunctor<c10::Half, 2, 1, 1>, at::native::Copy<c10::Half, c10::Half> >(at::native::(anonymous namespace)::TensorListMetadata<2>, at::native::(anonymous namespace)::UnaryOpFunctor<c10::Half, 2, 1, 1>, at::native::Copy<c10::Half, c10::Half>)",
              "triton_per_fused_clamp_min_div_expand_linalg_vector_norm_mul_0",
              "sm86_xmma_fprop_implicit_gemm_f16f16_f16f32_f32_nhwckrsc_nhwc_tilesize256x64x32_stage4_warpsize4x1x1_g1_tensor16x8x16_execute_kernel__5x_cudnn",
              "triton_red_fused__softmax_cat_expand_prepare_softmax_online_select_split_unsqueeze_view_1",
              "triton_per_fused__softmax_cat_expand_prepare_softmax_online_select_split_unsqueeze_view_2",
              "triton_red_fused__softmax_cat_expand_prepare_softmax_online_select_split_unsqueeze_view_3",
              "triton_per_fused__softmax_cat_expand_prepare_softmax_online_select_split_unsqueeze_view_4",
              "triton_poi_fused__softmax_cat_exp_expand_select_split_sub_unsqueeze_view_5",
              "triton_poi_fused_cat_expand_select_split_unsqueeze_view_6",
              "void cutlass::Kernel2<cutlass_80_wmma_tensorop_f16_s161616gemm_f16_32x32_128x2_tn_align2>(cutlass_80_wmma_tensorop_f16_s161616gemm_f16_32x32_128x2_tn_align2::Params)",
              "triton_per_fused__softmax_prepare_softmax_online_split_view_7",
              "triton_poi_fused__softmax_exp_mul_split_sub_view_8",
              "ampere_fp16_s16816gemm_fp16_128x64_ldg8_f2f_nt",
              "triton_poi_fused_convolution_view_9",
              "sm80_xmma_fprop_implicit_gemm_f16f16_f16f32_f32_nhwckrsc_nhwc_tilesize64x32x64_stage5_warpsize2x2x1_g1_tensor16x8x16_execute_kernel__5x_cudnn",
              "triton_per_fused_clamp_min_convolution_div_expand_linalg_vector_norm_mul_view_10"
            ],
            "selected_cuda_names": [
              "void at::native::(anonymous namespace)::multi_tensor_apply_kernel<at::native::(anonymous namespace)::TensorListMetadata<2>, at::native::(anonymous namespace)::UnaryOpFunctor<c10::Half, 2, 1, 1>, at::native::Copy<c10::Half, c10::Half> >(at::native::(anonymous namespace)::TensorListMetadata<2>, at::native::(anonymous namespace)::UnaryOpFunctor<c10::Half, 2, 1, 1>, at::native::Copy<c10::Half, c10::Half>)",
              "sm86_xmma_fprop_implicit_gemm_f16f16_f16f32_f32_nhwckrsc_nhwc_tilesize256x64x32_stage4_warpsize4x1x1_g1_tensor16x8x16_execute_kernel__5x_cudnn",
              "void cutlass::Kernel2<cutlass_80_wmma_tensorop_f16_s161616gemm_f16_32x32_128x2_tn_align2>(cutlass_80_wmma_tensorop_f16_s161616gemm_f16_32x32_128x2_tn_align2::Params)",
              "ampere_fp16_s16816gemm_fp16_128x64_ldg8_f2f_nt",
              "sm80_xmma_fprop_implicit_gemm_f16f16_f16f32_f32_nhwckrsc_nhwc_tilesize64x32x64_stage5_warpsize2x2x1_g1_tensor16x8x16_execute_kernel__5x_cudnn"
            ]
          },
          "evidence": {
            "copy_in_profiler": true,
            "copy_kernels": [
              "void at::native::(anonymous namespace)::multi_tensor_apply_kernel<at::native::(anonymous namespace)::TensorListMetadata<2>, at::native::(anonymous namespace)::UnaryOpFunctor<c10::Half, 2, 1, 1>, at::native::Copy<c10::Half, c10::Half> >(at::native::(anonymous namespace)::TensorListMetadata<2>, at::native::(anonymous namespace)::UnaryOpFunctor<c10::Half, 2, 1, 1>, at::native::Copy<c10::Half, c10::Half>)"
            ],
            "copy_in_fx": false,
            "copy_in_pre_fusion": false,
            "copy_in_post_fusion": false,
            "copy_fused_or_eliminated": false,
            "materialization_retained_in_compiled": true,
            "gemm_kernel_count": 4,
            "gemm_families": [
              "gemm",
              "align2",
              "gemm",
              "gemm"
            ],
            "first_gemm_family": "gemm",
            "second_gemm_family": "align2",
            "generated_strides": [
              "stride=(1, 1)"
            ],
            "evidence_source": [
              "profiler",
              "fx_graph",
              "pre_fusion",
              "post_fusion",
              "output_code"
            ]
          }
        },
        "repair_kv": {
          "available": true,
          "first_call_ms": 4842.556613031775,
          "steady_state": {
            "n": 10,
            "median_ms": 0.3674623966217041,
            "mean_ms": 0.36748800516128544,
            "min_ms": 0.36720640659332277,
            "max_ms": 0.3678208112716675
          },
          "correctness": {
            "max_abs": 0.001953125,
            "relative_inf": 0.001001001001001001,
            "tolerance": 0.08,
            "pass": true
          },
          "artifacts": {
            "fx_graph": "fx_graph.txt",
            "export_graph": "export_graph.txt",
            "pre_fusion": "ir_pre_fusion.txt",
            "post_fusion": "ir_post_fusion.txt",
            "output_code": "output_code.py",
            "fx_transformed": "fx_graph_transformed.py",
            "fx_runnable": "fx_graph_runnable.py"
          },
          "profiler": {
            "available": true,
            "ordered_cuda_names": [
              "void at::native::(anonymous namespace)::multi_tensor_apply_kernel<at::native::(anonymous namespace)::TensorListMetadata<2>, at::native::(anonymous namespace)::UnaryOpFunctor<c10::Half, 2, 1, 1>, at::native::Copy<c10::Half, c10::Half> >(at::native::(anonymous namespace)::TensorListMetadata<2>, at::native::(anonymous namespace)::UnaryOpFunctor<c10::Half, 2, 1, 1>, at::native::Copy<c10::Half, c10::Half>)",
              "triton_per_fused_clamp_min_div_expand_linalg_vector_norm_mul_0",
              "sm86_xmma_fprop_implicit_gemm_f16f16_f16f32_f32_nhwckrsc_nhwc_tilesize256x64x32_stage4_warpsize4x1x1_g1_tensor16x8x16_execute_kernel__5x_cudnn",
              "triton_red_fused__softmax_cat_expand_prepare_softmax_online_select_split_unsqueeze_view_1",
              "triton_per_fused__softmax_cat_expand_prepare_softmax_online_select_split_unsqueeze_view_2",
              "triton_red_fused__softmax_cat_expand_prepare_softmax_online_select_split_unsqueeze_view_3",
              "triton_per_fused__softmax_cat_expand_prepare_softmax_online_select_split_unsqueeze_view_4",
              "triton_poi_fused__softmax_cat_clone_exp_expand_select_split_sub_transpose_unsqueeze_view_5",
              "triton_poi_fused_cat_clone_expand_select_split_transpose_unsqueeze_view_6",
              "void cutlass::Kernel2<cutlass_80_wmma_tensorop_f16_s161616gemm_f16_16x16_128x2_nt_align8>(cutlass_80_wmma_tensorop_f16_s161616gemm_f16_16x16_128x2_nt_align8::Params)",
              "triton_per_fused__softmax_prepare_softmax_online_split_view_7",
              "triton_poi_fused__softmax_exp_mul_split_sub_view_8",
              "ampere_fp16_s16816gemm_fp16_128x64_ldg8_f2f_nt",
              "triton_poi_fused_convolution_view_9",
              "sm80_xmma_fprop_implicit_gemm_f16f16_f16f32_f32_nhwckrsc_nhwc_tilesize64x32x64_stage5_warpsize2x2x1_g1_tensor16x8x16_execute_kernel__5x_cudnn",
              "triton_per_fused_clamp_min_convolution_div_expand_linalg_vector_norm_mul_view_10"
            ],
            "selected_cuda_names": [
              "void at::native::(anonymous namespace)::multi_tensor_apply_kernel<at::native::(anonymous namespace)::TensorListMetadata<2>, at::native::(anonymous namespace)::UnaryOpFunctor<c10::Half, 2, 1, 1>, at::native::Copy<c10::Half, c10::Half> >(at::native::(anonymous namespace)::TensorListMetadata<2>, at::native::(anonymous namespace)::UnaryOpFunctor<c10::Half, 2, 1, 1>, at::native::Copy<c10::Half, c10::Half>)",
              "sm86_xmma_fprop_implicit_gemm_f16f16_f16f32_f32_nhwckrsc_nhwc_tilesize256x64x32_stage4_warpsize4x1x1_g1_tensor16x8x16_execute_kernel__5x_cudnn",
              "triton_poi_fused__softmax_cat_clone_exp_expand_select_split_sub_transpose_unsqueeze_view_5",
              "triton_poi_fused_cat_clone_expand_select_split_transpose_unsqueeze_view_6",
              "void cutlass::Kernel2<cutlass_80_wmma_tensorop_f16_s161616gemm_f16_16x16_128x2_nt_align8>(cutlass_80_wmma_tensorop_f16_s161616gemm_f16_16x16_128x2_nt_align8::Params)",
              "ampere_fp16_s16816gemm_fp16_128x64_ldg8_f2f_nt",
              "sm80_xmma_fprop_implicit_gemm_f16f16_f16f32_f32_nhwckrsc_nhwc_tilesize64x32x64_stage5_warpsize2x2x1_g1_tensor16x8x16_execute_kernel__5x_cudnn"